capitulo,descricao
O Kart de Lata que Virou Lenda,"Ayrton Senna começou sua jornada no kart aos 4 anos, pilotando um pequeno kart improvisado por seu pai, Milton. Feito com motor de cortador de grama, aquele kart seria a primeira pista de que um gênio estava nascendo. Desde cedo, Senna demonstrava uma habilidade natural para guiar, traçando linhas perfeitas e entendendo o comportamento do veículo de forma instintiva. Esse amor pelo karting seguiu com ele durante toda a carreira, e Senna sempre afirmou que ""kart é a forma mais pura de corrida""."
Primeira Vitória na F1 — Estoril 1985,"Em apenas sua segunda temporada na Fórmula 1, Senna mostrou ao mundo o porquê de ser considerado uma força da natureza. Sob chuva torrencial no circuito de Estoril, em Portugal, Ayrton dominou cada curva como se dançasse com o asfalto molhado. Com uma Lotus preta e dourada deslizando como se estivesse em trilhos invisíveis, ele venceu com uma vantagem absurda. Essa vitória marcou o início de uma era, e a assinatura de Senna como o ""Rei da Chuva""."
A Magia na Chuva — Donington 1993,"11 de abril de 1993. Sob condições absolutamente caóticas, Senna protagonizou uma das maiores voltas da história da Fórmula 1. Largando em quarto, ele ultrapassou Michael Schumacher, Karl Wendlinger, Damon Hill e Alain Prost em apenas uma volta. Cada curva de Donington foi uma obra de arte aquática, com Senna dançando sobre poças e aquaplanagem como se fosse seu habitat natural. Essa corrida solidificou sua lenda como mestre absoluto da chuva."
A Volta Perfeita em Mônaco,"Treino oficial de Mônaco, 1988. Ayrton Senna, em sua McLaren, fez o que até hoje é considerado um momento sobrenatural na história da F1. A chamada ""volta perfeita"". Ele superou Alain Prost por 1,4 segundo — um abismo em termos de classificação. O próprio Senna afirmou que, naquela volta, ele ""saiu do corpo"", dirigindo como se fosse guiado por uma força externa. Mesmo décadas depois, essa volta é estudada como um fenômeno técnico e espiritual."
Senna e Prost — Guerra de Gigantes,"Entre 1988 e 1993, a Fórmula 1 virou palco de uma das maiores rivalidades esportivas da história: Ayrton Senna vs. Alain Prost. O brasileiro, puro talento e emoção. O francês, cirúrgico e calculista. As colisões em Suzuka 1989 e 1990 viraram lendas. Essa rivalidade não foi apenas esportiva; virou um embate filosófico entre diferentes visões sobre como vencer. Até hoje, Senna e Prost são sinônimos de rivalidade pura."
Brasil em Lágrimas — Interlagos 1991,"O sonho de vencer em casa parecia impossível. Com problemas no câmbio, Ayrton passou as últimas voltas preso na sexta marcha. Mesmo assim, segurou Mansell e cruzou a linha de chegada exausto, mal conseguindo sair do carro. Chorando no pódio, ele emocionou todo o Brasil. Foi a vitória mais sofrida e simbólica da carreira, transformando Senna em herói nacional absoluto."
Ayrton Off-Track — O Homem por Trás do Mito,"Fora das pistas, Ayrton era um homem introspectivo, espiritualizado e extremamente generoso. Ajudava crianças carentes anonimamente, meditava antes de cada corrida e acreditava que sua missão transcendia a F1. Após sua morte, descobriu-se que boa parte de sua fortuna era doada a causas sociais. Esse lado humano é parte fundamental do legado que inspira gerações até hoje."
O Capacete Amarelo — Símbolo Imortal,"O capacete amarelo com faixas verdes e azuis virou um ícone global. Criado pelo designer Sid Mosca, o capacete refletia as cores do Brasil e simbolizava velocidade, ousadia e orgulho nacional. Cada vez que o capacete brilhava na tela da TV, milhões sabiam que Senna estava atacando. Hoje, esse capacete é mais que um item esportivo — é uma peça de história e cultura brasileira."
O Último Ato — Imola 1994,"Em 1º de maio de 1994, no GP de San Marino, Ayrton Senna partiu. Ao bater na curva Tamburello, o mundo parou. Sua morte não foi em vão: gerou uma revolução na segurança da F1, salvando incontáveis vidas depois. Seu carro carregava uma bandeira austríaca, que Senna pretendia erguer em homenagem a Roland Ratzenberger, morto um dia antes. Esse gesto nunca aconteceu, mas simboliza o coração gigante do piloto."
O Legado Inquebrável,"Ayrton Senna não é apenas um piloto, é uma lenda cultural. Sua mentalidade de buscar a perfeição, sua conexão com o povo, sua paixão pela velocidade — tudo isso fez dele um arquétipo do herói moderno. Mais do que títulos e vitórias, seu legado é uma lição de coragem, excelência e humanidade. E enquanto houver alguém acelerando em busca do impossível, Senna viverá."
